URL;Titre;Description;ImageFilename
https://www.academiedugout.fr/ingredients/morbier_635;Morbier;Protégé par une appellation d’origine contrôlée depuis 2000, le morbier est un fromage de lait cru de vache originaire du Jura. Parfois considéré, à tort, comme unfromage à pâte persillée, il entre en fait dans la catégorie des pâtes pressées non cuites. Quid de sa couche intérieure grise presque bleue ? Il ne s’agit pas dupenicillium roquefortides bleus mais d’une couche de charbon végétal. Autrefois, elle servait à protéger la première partie du fromage réalisée avec les restes du caillé après la fabrication du comté. On la recouvrait de suie puis les restes suivants constituaient la deuxième moitié du morbier. Aujourd’hui, cette couche n’est plus que décorative.;fotolia_30265425_subscription_xl-copy.jpg
https://www.academiedugout.fr/ingredients/mozzarella-di-bufala-campana_735;Mozzarella di bufala campana;La mozzarella di Bufala Camapana est LA mozzarella dans toute son authenticité. Ce fromage à pâte pressée et filée fait exclusivement à partir de lait de bufflonne est l’un des porte-étendards de la gastronomie italienne. Ce fromage frais fabriqué de manière artisanale en Campanie dans le sud de l’Italie bénéficie d’une AOC depuis 1996. Label qui lui permet de se démarquer des productions industrielles de mozzarella faites à partir de lait de vache. De pâles copies qui ne parviennent pas à égaler la saveur douce et unique de la vraie mozzarella.;mozzarella-bufala-copy.jpg
https://www.academiedugout.fr/ingredients/munster_736;Munster;Le Munster est un fromage alsacien fait à partir de lait de vache cru originaire d’une vallée éponyme. C’est un fromage à pâte molle de forme cylindrique assez plat considéré comme le « Roi des fromages ». Le Munster est surtout connu de tous grâce ou à cause de son odeur persistance et tenace. C’est pourtant un fromage qui se révèle particulièrement doux en bouche. Du côté des Vosges, il est appelé munster-géromé, fromage de mêmes composition et fabrication que le munster alsacien. Ils bénéficient d’ailleurs tous deux d’une AOC depuis 1969 et d’une AOP depuis 1996.;munster.jpeg
https://www.academiedugout.fr/ingredients/neufchatel_636;Neufchâtel;Le Neufchâtel est un fromage au lait de vache, à pâte molle et à croûte fleurie fabriqué aux alentours de Neufchâtel-en-Bray, en Basse-Normandie. Il possède une appellation d’origine contrôlée depuis 1969 et est reconnaissable à sa forme en cœur. Sa saveur est délicate mais soutenue.;fotolia_46649555_subscription_l-copy.jpg
https://www.academiedugout.fr/ingredients/raclette_645;Raclette;Le fromage à raclette est l’ingrédient phare des repas hivernaux. Sans lui, la fameuse raclette n’aurait pas autant de succès. Originaire de Suisse où on l’appelait jadis « fromage à rôtir », ce fromage rond à pâte pressée non cuite et fait à partir de lait cru est également fabriqué en France (Savoie, Franche-Comté, Auvergne). Il se caractérise par une saveur douce et par un goût fruité aux notes florales.;raclette-copy.jpg
https://www.academiedugout.fr/ingredients/reblochon_697;Reblochon;Le reblochon est un fromage à pâte pressée non cuite produit à partir de lait entier de vache. Ce fromage français, qui bénéficie d’une appellation d’origine contrôlée depuis 1958, est produit en Savoie et en Haute-Savoie. Il est de forme circulaire, possède une croûte orangée, une pâte beige, une texture crémeuse et un petit goût de noisette. Son affinage dure entre 6 à 8 semaines.;fotolia_25058787_s-copy.jpg
https://www.academiedugout.fr/ingredients/rouy_638;Rouy;Le Rouy est un fromage à pâte molle à croûte lavée semblable auPont l’Evêqueou duCarré de l’Est. Egalement fabriqué à base de lait de vache, il se distingue par sa belle croûte légèrement orangée due au roucou, épice utilisée comme colorant. C’est un fromage plutôt récent puisqu’il est né au début du XXe siècle en Bourgogne. Son nom vient du patronyme du fromager qui l’a créé, monsieur Rouy, mais on le retrouve parfois sous l’appellation « Pavé ocre ».;fotolia_49361142_subscription_xl-copy.jpg
https://www.academiedugout.fr/ingredients/saint-marcellin_639;Saint-Marcellin;Le Saint-Marcellin est un petit fromage rond fabriqué à partir de lait de vache cru ou pasteurisé. Originaire d’une commune éponyme du département de l’Isère, ce fromage à pâte molle et à croûte fleurie bénéficie depuis 2013 d’une IGP. Le Saint-Marcellin se caractérise par une saveur douce qui se renforce en vieillissant et par un cœur crémeux ou sec.;saint-marcellin-copy.jpg
https://www.academiedugout.fr/ingredients/saint-nectaire_640;Saint-Nectaire;Le Saint-Nectaire est un fromage auvergnat dont l’appellation d’origine fut reconnue dès 1955 avant d’obtenir une AOC en 1964. Ce fromage à pâte pressée non cuite fait à partir de lait de vache cru ou pasteurisé est fabriqué aux Monts Dore, zone volcanique recouvrant le nord du Cantal et le sud du Puy-de-Dôme. Le Saint-Nectaire est un fromage goûteux très apprécié par sa saveur de noisette et sa pâte souple qui se prête à toute sorte d’apprêts culinaires.;saint-nectaire-copy.jpg
https://www.academiedugout.fr/ingredients/saint-paulin_641;Saint-Paulin;Le Saint-Paulin est un fromage à pâte pressée non cuite dont la croûte orangée est fine et humide et la pâte de couleur ivoire est souple. Fabriqué autrefois à partir de lait cru de vache par des moines trappistes, ce fromage est aujourd’hui principalement produit de manière industrielle dans les départements du Nord et de la Mayenne ou encore en Bretagne. Son goût peu marqué et légèrement salé en fait un fromage qui se prête facilement à la cuisine.;saint-paulin-copy.jpg
https://www.academiedugout.fr/ingredients/uf-de-caille_470;Œuf de caille;L’œuf de caille est un œuf de petite taille de couleur blanc crème à verdâtre tacheté de brun pondu par une caille, petit volatile à la chair tendre et savoureuse. Un œuf pèse environ 10 g, soit environ cinq fois moins qu’un œuf de poule.;fotolia_60393870_subscription_xl-copy.jpg
https://www.academiedugout.fr/ingredients/tomme-de-savoie_643;Tomme de Savoie;Les tommes (ou tomes) sont une variété de fromage de montagne, généralement à pâte pressée non cuite. On trouve des tommes de brebis, de lait de vache, d’Italie, de Savoie, de Suisse, du Cantal. La plus emblématique reste probablement la tomme de Savoie, qui bénéficie d’une indication géographique protégée depuis 1996. Elle est fabriquée à base de lait de vache, possède une croûte fleurie, et peut être laitière ou fermière. La tomme de Savoie est affinée d’un à trois mois. On en produit plus de 6000 tonnes par an.;fotolia_57659710_subscription_xxl-copy.jpg
https://www.academiedugout.fr/ingredients/mont-dor_634;Mont d’Or;Le Mont d’Or (sans trait d'union !) ou Vacherin du Haut-Doubs est un fromage à pâte molle franc-comtois fabriqué à partir de lait de vache cru provenant de races précises : la Montbéliarde et la Simmental. Ce fromage tire son nom du Massif du Jura où paissent ces vaches à plus de 700 m d’altitude. AOC depuis 1981 et AOP depuis 1996, ce fromage dont la particularité est d’être sanglé par une écorce d’épicéa révèle une douceur et une onctuosité incomparables.;mont-dor-copy.jpg
https://www.academiedugout.fr/ingredients/gruyere-suisse_625;Gruyère Suisse;Attention à ne pas confondre legruyère françaiset le gruyère suisse. Si les deux sont des fromages à pâte pressée cuite au lait de vache cru, le français est constellé de petits trous tandis que la pâte du suisse est uniforme. Fabriqué dans quatre cantons (Fribourg, Vaud, Neuchâtel, Jura), le gruyère suisse est produit en grosses meules convexes pouvant peser jusqu’à quarante kilos. Il est plus ou moins affiné, de quelques mois jusqu’à deux ans.;29-01-2010_gruyere-suisse-copy.jpg
https://www.academiedugout.fr/ingredients/creme-chantilly_615;Crème chantilly;La crème chantilly est une crème fouettée dans laquelle on incorpore du sucre (glace généralement). Décorative, la crème chantilly est essentiellement utilisée en pâtisserie. Elle doit son nom au Château de Chantilly, où elle aurait été popularisée, bien que son origine semble plutôt être italienne. Catherine de Médicis, épouse du roi de France Henri II, l'aurait introduite à la Cour au XVIe siècle.;fotolia_41963938_subscription_xxl-copy.jpg
https://www.academiedugout.fr/ingredients/oeufs-fromages-et-produits-laitiers_865;Oeuf;Un œuf est le produit de la ponte d’un oiseau femelle. Lorsque le mot « œuf » est employé seul, il s’agit toujours de celui d’une poule sinon il est obligatoirement suivi du nom de l’oiselle : œuf de cane,œuf de caille, etc. L’œuf est composé d’une coquille (environ 7 g) blanche ou rousse selon la race de la poule. Cette coquille calcaire et poreuse est recouverte d’une fine pellicule imperméable protégeant l’œuf de l’air et des bactéries. À l’intérieur, elle est tapissée d’une autre membrane qui laisse un espace au sommet le plus arrondi de l’œuf : la « chambre à air », témoin du vieillissement de l’œuf car elle augmente de volume au fil du temps. Vient ensuite le blanc, ou albumen (environ 20 g), composé d’eau à 90 % et de protéines. Et enfin, le jaune (en moyenne 35 g) composé d’eau, de protéines, de lipides et de lécithine. Entouré lui aussi d’une membrane, il est relié de chaque côté à la coquille par un petit cordon de mucus, les chalazes, qui le maintiennent en suspension dans le blanc d’œuf.;oeuf_000.jpg
https://www.academiedugout.fr/ingredients/fromage-de-chevre_2655;Fromage de chèvre;La France est le premier producteur mondial de lait avec ses 500 millions de lait collecté, ce qui représente près de 100 000 tonnes de fromage de chèvre produits (80% concerne la production industrielle, et 20% la production fermière). La France compte plus de 100 variétés de fromage de chèvre avec une diversité de formes et de saveurs incroyables. Certains fromages sont propres à une région comme le Rocamadour et d'autres se sont popularisés dans toute la France comme la bûchette, format le plus vendu. Le fromage de chèvre se consomme frais - il entre alors dans la composition de recettes aussi bien sucrées que salées-, ou affiné (entre 8 jours et un mois), on le déguste alors à l'apéritif, à la fin d'un repas sous forme d'un plateau de fromages, émietté sur une salade ou fondu dans un gratin.;fotolia_56788459_subscription_xl.jpg
