URL;Titre;Description;ImageFilename
https://www.academiedugout.fr/ingredients/comte_665;Comté;Le comté est un fromage au lait cru de vache, à pâte pressée et cuite produit dans le Massif du Jura. Il bénéficie d'une AOP, qui limite sa zone de production aux pâturages de moyenne montagne du massif du Jura. Les meules de comté (35 kg minimum) sont affinées en cave pendant au moins 4 mois. L'affinage peut se prolonger jusqu'à 24 mois pour les comtés « vieux », au goût plus affirmé. Le comté est l'un des fromages le plus riche en calcium et protéines. Il est bien pourvu en vitamine A, B12 et D.;fotolia_30861754_subscription_xxl-copy.jpg
https://www.academiedugout.fr/ingredients/emmental_721;Emmental;"Originaire de Suisse, plus précisément de la vallée de l’Emme, l’emmental est un fromage à pâte cuite pressée fait à partir de lait de vache cru. Son équivalent en France, du même nom, regroupe cependant deux entités distinctes : l’emmental français de consommation courante et de qualité moindre davantage employé râpé ; l’emmental labellisé de qualité supérieure qui concerne l’emmental de Savoie et l’emmental grand cru Est-central (Franche-Comté). Leur arôme doux, fruité et subtil fait de ce fromage imposant un ingrédient indispensable en cuisine.";emmental-copy.jpg
https://www.academiedugout.fr/ingredients/feta_941;Feta;La feta est un fromage à pâte molle, de couleur blanche, sans croûte et caillé en saumure. Il est ferme et friable et possède un goût frais, salé et légèrement acidulé. Cette spécialité grecque est confectionnée à partir de lait de brebis ou de lait de chèvre. La feta tient son nom du mot italien « fetta » qui signifie « tranche ». Depuis 2002, la feta possède une appellation d’origine protégée au sein de l’Union européenne.;fotolia_62235042_subscription_lok.jpg
https://www.academiedugout.fr/ingredients/fromage-blanc_624;Fromage blanc;Le fromage blanc est un fromage à pâte fraîche non affiné. On l’obtient par coagulation lactique, avec ou sans présure, à partir de lait cru ou de lait écrémé pasteurisé de vache, et parfois de chèvre. Traditionnellement, le fromage blanc se fabrique en laissant le lait au frais le temps que la crème monte. On enlève cette crème ainsi que le petit lait avant de l’égoutter. Sa pâte blanche a une consistance semi-fluide, crémeuse et molle. Il se distingue du fromage frais, nettement plus ferme.;fotolia_46753493_subscription_xxl-copy.jpg
https://www.academiedugout.fr/ingredients/mascarpone_633;Mascarpone;Le mascarpone est un fromage frais, doux et onctueux, originaire du nord de l'Italie. Traditionnellement réalisé avec du lait de bufflone, il est aujourd'hui fabriqué avec du lait de vache. La crème du lait est chauffée à 90-100°C puis caillée avant d'être mise à égoutter pendant un à deux jours. Le mascarpone est enfin salé et légèrement fouetté. Sa texture est à mi-chemin entre la crème et le beurre, ce qui lui vaut le nom de « triple crème ». Le taux de matière grasse du mascarpone se situe entre 45 et 80%. Riche en calcium et en phosphore, il est également bien pourvu en vitamine A.;fotolia_44368620_subscription_xl-copy.jpg
https://www.academiedugout.fr/ingredients/mozzarella_734;Mozzarella;Aujourd’hui 90% de la production de mozzarella est industrielle et fabriquée à partir de lait de vache. La mozzarella est devenu un terme presque générique qui regroupe aussi bien l’authentique mozzarella au lait de bufflonne (mozzarella di Bufala Campana) que sa copie faite à partir de lait de vache. Une dénomination qui peut prêter à confusion et qui joue sur l’ambiguïté. Pourtant la mozzarella n’est pas qu’un vulgaire fromage à pizza, si elle est de qualité, cette dernière révèle une saveur douce à la texture crémeuse qui se suffit à elle-même.;mozzarella-copy.jpg
https://www.academiedugout.fr/ingredients/parmesan_637;Parmesan;Derrière le nom de parmesan se cache le Parmigiano Reggiano, un fromage italien à pâte pressée cuite réalisé avec le lait de vache reggiana et fabriqué dans une zone bien précise du pays (Emilie-Romagne). Mais on retrouve bien souvent d’autres fromages similaires vendus sous le nom de « parmesan » qui ne sont pas protégés par un label. C'est le cas du Grana Padano dont les conditions de fabrication bien moins strictes, tant sur l'alimentation des vaches et leur race (pour le véritable parmesan, elles ne sont nourries qu’à l'herbe fraîche et aux fourrages secs indigènes) que sur l’élaboration et l’affinage, davantage industrialisés. Il peut néanmoins y avoir d’excellents Grana Padano.;fotolia_50197543_subscription_xxl.jpg
https://www.academiedugout.fr/ingredients/pecorino_644;Pecorino;Le pecorino est un fromage italien à pâte dure fabriqué à partir de lait entier de brebis. Dérivant de pecora (brebis en italien), « pecorino » est en réalité un terme générique désignant en Italie tous les fromages de brebis. Ce fromage se caractérise par une fine croûte lisse, par une pâte blanche ferme et cassante et par une saveur douce ou piquante selon l’affinage. Très utilisé dans la gastronomie italienne, le pecorino bénéficie d’une AOP depuis 1996.;pecorino-copy.jpg
https://www.academiedugout.fr/ingredients/ricotta_699;Ricotta;La ricotta est un fromage à pâte fraîche, réalisé à base de lait de vache ou de brebis et plus rarement à base de lait de chèvre. La ricotta est un fromage originaire d’Italie mais aussi de Malte. Elle ne possède pas d’appellation d’origine contrôlée. Le nom de ricotta appartenant au domaine public, il n’y a pas de cahier des charges précis. La ricotta est donc un produit qui peut varier dans sa composition d’une production à une autre. Toutefois, la ricotta presque toujours un goût frais et légèrement salé.;fotolia_60947172_s-copy.jpg
https://www.academiedugout.fr/ingredients/roquefort_712;Roquefort;Le roquefort est un fromage français àpâte persillée, non cuite et non pressée, réalisé à partir de lait cru de brebis. Produit dans l’Aveyron, le roquefort possède une appellation d’origine contrôlée depuis 1979. Il se présente sous forme d’un cylindre dont la pâte blanche onctueuse est parsemée de petites moisissures de couleur bleue ou verte.;fotolia_52435092_s-copy.jpg
https://www.academiedugout.fr/ingredients/yaourt_818;Yaourt;Produit ancestral, le yaourt, aussi appelé yoghourt ou yogourt, est du lait de vache, de brebis ou de chèvre, voire d’un autre mammifère, fermenté, qui forme ainsi un caillé plus ou moins liquide et légèrement acide. Sa fabrication est simple : le lait est chauffé à 45 °C, et des ferments (streptococcus thermophilusetlactobacillus bulgaricum, et parfoisbifidusetacidophilus) sont ajoutés dans les cuves ou dans les pots. Ils se développent au profit du lactose, le glucide du lait, et provoquent la formation d’acide lactique. Celui-ci fait lentement coaguler la caséine, la protéine du lait. Le refroidissement accéléré en chambre froide stoppe cette fermentation.;yaourt_000.jpg
https://www.academiedugout.fr/ingredients/fromage-a-pate-dure_621;Fromage à pâte dure;Il existe plusieurs types de fromage :fromage à pâte persillée, fromage à pâte pressée cuite,fromage à pâte molle, à pâte fraîche. La caractéristique de la pâte du fromage résulte du processus de fabrication. Les fromages à pâte dure ont sensiblement la même texture que ceux à pâte pressée cuite. Le parmesan et le grana padano (Italie) sont des exemples de fromage à pâte dure comme le sbrinz (Suisse).;emmental-copy.jpg
https://www.academiedugout.fr/ingredients/fromage-a-pate-molle_622;Fromage à pâte molle;Il existe plusieurs types de fromage :fromage à pâte dure, fromage à pâte pressée cuite,fromage à pâte persilléeou à pâte fraîche. La caractéristique de la pâte du fromage résulte du processus de fabrication. Les fromages français les plus emblématiques sont bien souvent des fromages à pâte molle comme le camembert ou le Mont d’Or. Les fromages à pâte molle se divisent en deux catégories selon leur croûte : fleurie ou lavée. Ils peuvent être pasteurisés ou non.;fotolia_46322014_subscription_xl-copy.jpg
https://www.academiedugout.fr/ingredients/fromage-a-pate-persillee_623;Fromage à pâte persillée;Il existe plusieurs types de fromage :fromage à pâte dure, fromage à pâte pressée cuite,fromage à pâte molle, à pâte fraîche. La caractéristique de la pâte du fromage résulte du processus de fabrication. Les fromages à pâte persillée (également appelés « bleus » ou fromages à pâte à moisissure interne) regroupent l’ensemble des fromages dont la pâte est parsemée de champignons, lepenicillium glaucumoupenicillium roqueforti. Parmi les fromages à pâte persillée les plus célèbres, on compte le roquefort, la fourme d’Ambert ou le gorgonzola (Italie) et le stilton (Royaume-Uni).;fotolia_40378943_subscription_xl-copy.jpg
https://www.academiedugout.fr/ingredients/beaufort_732;Beaufort;AOC depuis 1968, A0P depuis 2009, le Beaufort est sans conteste un fromage d'une grande qualité. Porte-drapeau de la cuisine savoyarde, cela ne l'empêche pas de sortir de sa zone de confort et de s'aventurer vers d'autres mets pour leur conférer force et caractère. Ce fromage de haute montagne à pâte pressée cuite est fait à partir de lait cru. Il s'agit d'une variété de gruyère aux arômes fruités et floraux exclusivement produite en Savoie, entre autres dans la vallée du Beaufortin, d'où son nom.;beaufort-copy.jpg
https://www.academiedugout.fr/ingredients/boursin_607;Boursin;Boursin® est une marque de fromage frais à pâte salée commercialisée depuis 1963. Fabriqué à base de lait de vache, le boursin se décline en plusieurs versions, comme ail et fines herbes, poivre ou échalote et ciboulette. Certaines formulations sont spécialement étudiées pour la cuisine et tiennent mieux la cuisson. Depuis une cinquantaine d’année, le fromage frais a su se frayer une place dans bien des recettes.;fotolia_35615534_subscription_xl-copy.jpg
https://www.academiedugout.fr/ingredients/brie_608;Brie;Le brie est un fromage français à pâte molle à croûte fleurie, fabriqué à base de lait de vache. Il tient son nom de la région de la Brie qui correspond à la partie est du bassin parisien. Depuis 1980, deux variétés de brie bénéficient d’une appellation d’origine contrôlée (AOC) : le brie de Meaux et le brie de Melun. Ces deux bries sont réalisés avec du lait cru et leur fabrication respecte un cahier des charges très précis. Au total, il existe cependant près d’une dizaine de variétés de brie, dont le brie de Coulommiers, le brie de Provins ou encore le brie de Montereau. Pour chacune de ces recettes, il faut compter environ 25 litres de lait pour confectionner un fromage de 3,5 kg et la période d’affinage dure entre 4 et 12 semaines. Surnommé « le fromage des rois », le brie était, selon la légende, très apprécié par Charlemagne.;fotolia_23653053_subscription_xl-copy.jpg
https://www.academiedugout.fr/ingredients/brocciu_609;Brocciu;Le brocciu est un fromage à pâte fraîche originaire de Corse fabriqué à partir de petit-lait (lactosérum) de brebis ou de chèvre. Ce fromage sans croûte blanc et crémeux moulé dans des faisselles bénéficie d’une AOC depuis 1983. Le brocciu révèle une saveur douce, ce qui permet de l’employer aussi bien dans les préparations salées que sucrées.;brocciu-copy.jpg
https://www.academiedugout.fr/ingredients/burrata_610;Burrata;La burrata est un fromage frais originaire du Sud de l’Italie qui a conquis ces dernières années le palais des gastronomes français. Ce fromage n’est autre qu’unemozzarellafourrée de crème et de morceaux de mozzarella, farce appelée stracciatella. Crémeuse et onctueuse, la burrata révèle toute sa saveur crue mais peut être amenée à être cuisinée comme la mozzarella.;fotolia_34107547_subscription_xxl1.jpg
https://www.academiedugout.fr/ingredients/caille-de-brebis_611;Caillé de brebis;Le caillé de brebis, ou lait emprésuré, est un produit laitier connu depuis des millénaires. Il résulte de la coagulation du lait de brebis. Pour fabriquer le caillé de brebis, on utilise la présure, un coagulant d’origine animale issu de la caillette (le « quatrième estomac ») des jeunes ruminants. D’autres coagulants d’origine végétale ou fermentaire peuvent être utilisés. Le caillé de brebis est une spécialité du Pays Basque, il peut être consommé en dessert ou dans des recettes salées.;fotolia_55597857_subscription_xl-copy.jpg
https://www.academiedugout.fr/ingredients/camembert_655;Camembert;Spécialité emblématique de la Normandie, le camembert est un fromage de lait cru de vache à pâte molle. Génériquement, le mot camembert peut désigner un type de fromage, mais l’appellation « camembert de Normandie » est protégée depuis 1982 et rigoureusement contrôlée. Commercialisé dans une boîte en bois, le véritable camembert est moulé à la louche et présente 45% de matières grasses sur la matière brute. Les premières mentions du camembert remontent au XVIIIème siècle.;fotolia_46322014_subscription_xl-copy.jpg
https://www.academiedugout.fr/ingredients/cancoillotte_612;Cancoillotte;Spécialité franc-comtoise, la cancoillotte est un fromage à pâte fondue fabriqué avec du lait de vache. Elle est fabriquée avec le reste du lait une fois écrémé. Après coagulation, le lait est caillé. Après avoir été chauffé entre 60 et 80°C, on peut retirer le petit lait. On obtient avec la pâte restante le metton, un sérum de décaillage qui sera cuit, égoutté et émietté. Le metton est l’ingrédient principal de la cancoillotte. Désormais, il est affiné en caves chaudes où la transformation s’opère : il devient lisse, d’une belle couleur jaune et développe des arômes fruités.;cancoillote-copy.jpg
https://www.academiedugout.fr/ingredients/cantal_657;Cantal;Le cantal est un fromage à pâte pressée non cuite et à croûte séchée originaire de la région éponyme. Le cantal est protégé par une appellation d’origine contrôlée. Produit à base de lait de vache, il se présente en meule pesant de 35 à 45 kilos. Environ 400 litres de lait sont nécessaires pour une meule. Son goût varie selon son affinage, allant de 30 jours à plusieurs mois. Plus le cantal est vieux, plus sa pâte est friable et sa croûte est foncée.;fotolia_26034034_subscription_xxl-copy.jpg
https://www.academiedugout.fr/ingredients/carre-de-lest_613;Carré de l’Est;Le carré de l’Est est un fromage de vache à pâte molle et à croûte fleurie originaire de Lorraine. Comme son nom l’indique, il est de forme carrée, il mesure habituellement de 8,5 à 11 cm de côté. On le retrouve parfois sous le nom de Domrémy. Après avoir été affiné deux à trois semaines, le carré de l’Est a un goût peu prononcé qui en fait un fromage apprécié de tous.;carre-de-lest-copy.jpg
https://www.academiedugout.fr/ingredients/chaource_659;Chaource;Le chaource est un fromage d’appellation d'origine protégée (AOP) réalisé à partir de lait entier de vache. Il est produit au cœur de la Champagne humide dans une zone délimitée autour du village de Chaource. Doux et onctueux, ce fromage à la pâte molle et à la croûte fleurie contient au moins 50% de matières grasses sur extrait sec.;fotolia_43229510_subscription_l-copy.jpg
https://www.academiedugout.fr/ingredients/cheddar_660;Cheddar;Le cheddar est un fromage à pâte pressée non cuite réalisé avec du lait de vache cru lorsqu'il est « fermier ». Originaire de Grande-Bretagne, ce fromage est également produit aux Etats-Unis, au Canada et même en Inde. Seuls quelques producteurs du comté de Somerset dans le sud-ouest de l'Angleterre, bénéficient de l'appellation d'origine protégée (AOP) « West country farmhouse cheddar » garantissant une fabrication traditionnelle. Le cheddar affiné entre 9 et 12 mois développe une saveur typique, légèrement piquante et salée.;fotolia_30078845_subscription_l-copy.jpg
https://www.academiedugout.fr/ingredients/coulommiers_614;Coulommiers;Le coulommiers est un fromage à pâte molle et à croûte fleurie originaire d'Ile-de-France. Petit cousin dubrie, le coulommiers est élaboré avec du lait de vache cru, dans sa version fermière, ou pasteurisé, s'il est industriel. Le coulommiers affiche jusqu'à 50% de matière grasse sur extrait sec et son diamètre varie entre 13 et 15 cm. Il est affiné entre 21 et 28 jours en cave. Sa pâte jaune pastel est onctueuse et présente de fines notes d'amande douce.;fotolia_23653053_subscription_xl-copy.jpg
https://www.academiedugout.fr/ingredients/edam_619;Edam;L’edam est un fromage à pâte pressée semi-dure à base de lait de vache originaire du nord de la Hollande (il tient son nom de la ville portuaire d’Edam). Il est également fabriqué en France. Pour la petite histoire, cette production hexagonale remonte au XVIIème siècle, époque à laquelle Colbert en interdit l’importation. L’affinage de l’edam varie de 1 à 18 mois. Autrefois, l’edam était frotté avec un linge teint de vermeil, d’où sa couleur vive. Désormais, il est entouré d’une croûte de paraffine rouge, parfois jaune.;fotolia_41007581_subscription_xxl-copy.jpg
https://www.academiedugout.fr/ingredients/faisselle_927;Faisselle;La faisselle est un fromage frais le plus souvent réalisé à base de lait de vache pasteurisé. Il tient son nom du mot latin fiscella qui signifie « petite corbeille ». Ce terme renvoie au moule en plastique percé dans lequel la faisselle est égouttée. Ce fromage ne bénéficie d’aucune appellation d’origine contrôlée et peut donc être produit dans n’importe quelle région de France.;faisselle.jpg
https://www.academiedugout.fr/ingredients/pont-leveque_796;Pont-l'Evêque;Le Pont-l’Évêque est un fromage au lait de vache àpâte molleet à croûte lavée, produit sur un terroir s'étalant de la Normandie à la Mayenne. Il est reconnaissable à sa forme carrée d'environ 11 cm de côté et 3 cm d'épaisseur. Sa croûte souple est régulièrement lavée lors de son affinage. Elle passe ainsi du blanc ivoire au jaune paille, puis à l'orange laiteux. Bien que son odeur soit prononcée, sa pâte offre une saveur douce et beurrée ainsi que des arômes de noisettes lors de sa dégustation. Doyen des fromages normands, le Pont-l’Évêque bénéficie d'une appellation d'origine protégée (AOP). Sa pâte tendre comporte au moins 45% de matière grasse (sur extrait sec).;fotolia_46041107_subscription_l-copy.jpg
https://www.academiedugout.fr/ingredients/livarot_630;Livarot;"Le livarot est un fromage au lait de vache àpâte molleet à croûte lavée. Il est fabriqué depuis le Moyen-Âge en Normandie, au cœur du pays d'Auge. Il a obtenu l'appellation d'origine contrôlée (AOC) en 1975. L'affinage du livarot dure entre un à quatre mois en fonction de sa taille (de 7 et 12 cm de diamètre). Au cours de sa maturation, le fromage est lavé avec de l'eau colorée au roucou (graine de fruit tropical aux pigments rouges) et est régulièrement frotté avec du gros sel. Le livarot, aussi appelé ""Colonel"" est traditionnellement entouré de lanières de laîche (roseau) ou de papier de nos jours).";fotolia_42647992_subscription_xl-copy.jpg
https://www.academiedugout.fr/ingredients/margarine_631;Margarine;La margarine est une matière grasse d'origine végétale, utilisée comme alternative au beurre ou à l'huile pour la cuisson. Son invention date de la fin du XIXe siècle, où elle était alors réalisée à base de graisse de boeuf, de lait et d'eau. Aujourd'hui, elle est essentiellement issue de l'hydrogénation d'huiles végétales et contient ainsi des acides gras trans, dont la consommation excessive n'est pas recommandée par les organismes de santé.;fotolia_39861256_subscription_l-copy.jpg
https://www.academiedugout.fr/ingredients/maroilles_632;Maroilles;Le maroilles est un fromage au lait de vache, àpâte molleet à croûte lavée, originaire du Nord de la France. Il bénéficie d'une appellation d'origine contrôlée (AOC) depuis 1955 et ne peut être produit que dans quelques communes du Nord et de l'Aisne. Fromage de caractère, le maroilles se reconnaît à sa croûte de couleur rouge-orangé. Cette coloration est due au développement d'un ferment naturel au cours des lavages successifs du fromage à l'eau salée durant son affinage.;fotolia_46034431_subscription_l-copy.jpg
https://www.academiedugout.fr/ingredients/mimolette_686;Mimolette;Fromage à pâte pressée non cuite emblématique du nord de la France (on l’appelle également « Vieux Lille » ou « boule de Lille »), la mimolette se distingue par sa belle couleur orange. Cette dernière est due à l’utilisation d’un colorant. Proche dugoudaou de l’edamhollandais, la mimolette est depuis 2013 interdite aux Etats-Unis. En cause, l’utilisation de cérons (de petits acariens) pendant l’affinage. Utilisés dans fabrication de biens des fromages vieux, comme la tomme céronnée, ces arachnides ne sont pas au goût des américains.;fotolia_50694090_subscription_xxl-copy.jpg
https://www.academiedugout.fr/ingredients/fourme-dambert_620;Fourme d’Ambert;Fameuse spécialité auvergnate, la fourme d’Ambert est un fromage à pâte persillée non cuite et non pressée fait à partir de lait de vache. Ce fromage à la croûte sèche et fleurie de couleur grise est fabriqué avec de la présure, qui solidifie le lait, et dupenicillium roqueforti, auquel on doit le bleu de la fourme d’Ambert. Sa préparation et son affinage requièrent une grande attention, puisqu’il doit être « coiffé », c’est-à-dire brassé régulièrement, pour que la pâte soit uniformément persillée. Il est ensuite piqué (oxigéné) pour que le bleu soit présent partout dans la fourme, puis affiné pendant 28 jours ou plus.;fotolia_40378943_subscription_xl-copy.jpg
https://www.academiedugout.fr/ingredients/fromage-fermente_913;Fromages fermentés;Le fromage est le produit de la coagulation du lait, que celui-ci soit de vache, de chèvre, de brebis ou d’un autre mammifère. On distingue deux familles de fromages : les fromages frais, qui sont simplement du lait caillé plus ou moins égoutté, et les fromages fermentés. Il existe des centaines de ceux-ci sur toute la planète. Si la France est célèbre pour la multiplicité de ses fromages (l’Italie en compte aussi beaucoup), elle n’en est pas pour autant le plus grand producteur : les États-Unis et l’Allemagne la devancent. Mais quel que soit le pays, les grandes étapes de la fabrication des fromages fermentés sont les mêmes, ainsi que les différents types.;fromages-fermentes_000.jpg
https://www.academiedugout.fr/ingredients/fromage-frais_915;Fromage frais;Dans le vaste monde des fromages, les fromages frais tiennent une place à part. Non seulement parce que leur fabrication est plus simple , mais aussi parce qu’ils sont de deux types : d’une part, le fromage blanc, d’autre part, le fromage frais ou fromage à pâte fraîche. Ils proviennent tous, bien sûr, de la coagulation d’un lait.En Europe, ce terme est réservé à un fromage non affiné qui a simplement subi une fermentation lactique et qui est vendu dans un contenant : pots individuels ou seaux, ou faisselle.;fromage-frais_000.jpg
https://www.academiedugout.fr/ingredients/gorgonzola_724;Gorgonzola;Produit phare de la gastronomie italienne, le gorgonzola séduit de plus en plus le palais de fins gourmets français. Ce fromage persillé à pâte molle qui ressemble à s’y méprendre à du marbre est aussi gouteux que ses congénères hexagonaux. Détenteur d’une AOC depuis 1955 et d’une AOP depuis 1996, ce fromage italien doux et crémeux apporte une onctuosité aux sauces et aux crèmes, et rehausse le goût de différentes préparations salées.;gorgonzola-copy.jpg
https://www.academiedugout.fr/ingredients/gouda_733;Gouda;Fromage le plus consommé aux Pays-Bas, le gouda reste en France un fromage jugé fade et peu attrayant. Toutefois, ce fromage à pâte pressée non cuite fait à l’origine à partir de lait de vache entier est loin d’être un fromage bas de gamme. Jeune, vieux ou extra-vieux, ce fromage rond couvert de paraffine apporte une touche d’onctuosité à des préparations de l’apéritif au plat de résistance.;gouda-copy.jpg
https://www.academiedugout.fr/ingredients/gruyere-francais_626;Gruyère français;Contrairement augruyère suissedont la pâte est homogène, le gruyère français a des trous. Ces trous, dus à la libération de gaz carbonique pendant l’affinage (de 4 à 6 mois), sont la signature du gruyère français, protégé par une appellation d’origine contrôlée française et une indication géographique protégée européenne. Le gruyère français est un fromage à pâte pressée cuite fabriqué avec du lait cru de vache en Franche-Comté et dans la région Rhône-Alpes.;fotolia_49242712_subscription_xxl-copy.jpg
https://www.academiedugout.fr/ingredients/langres_629;Langres;Le langres est un fromage au lait de vache àpâte molleet à croûte lavée, fabriqué dans le département de la Haute-Marne (Champagne-Ardenne) ainsi que dans une partie des Vosges et de la Côte-d'Or. Il bénéficie depuis 1991 d'une appellation d'origine protégée (AOP). Le goût du langres et puissant, mais plus subtil que celui de son cousin régional, l'époisses.;fotolia_46081240_subscription_xl-copy.jpg
