URL;Titre;Description;ImageFilename
https://www.academiedugout.fr/ingredients/crevettes-grises_456;Crevettes grises;Les crevettes grises sont des crustacés de la famille des arthropodes. Elles portent le nom scientifique « Crangon crangon ». Les crevettes grises sont présentes sur ensemble des côtes françaises et européennes. Selon les régions, elles prennent le nom de « boucaut », « chevrette » ou encore « sauterelle » en Picardie, l'une des principale région productrice. A l'âge adulte, la crevette grise mesure entre 5 cm et 8 cm. Elle est pêchée à pied par les particuliers et en chalut par les professionnels.;fotolia_48087752_subscription_xl-copy.jpg
https://www.academiedugout.fr/ingredients/cuisses-de-grenouille_458;Cuisses de grenouille;"La grenouille est un amphibien (ou batracien) qui appartient, comme son cousin le crapaud et sa petite sœur la rainette, à la famille des anoures. Ces drôles d’animaux naissent et vivent dans l’eau douce, et rejoignent la terre quand ils sont adultes ; mais la grenouille, elle, préfère toujours ne pas s’en éloigner, et même y demeurer souvent. La grenouille a une grosse tête avec des yeux globuleux, un corps brun ou vert (selon les espèces) au ventre blanc, couvert d’une peau visqueuse et muni de quatre pattes ; celles de l’avant sont petites, celles de l’arrière sont longues et musclées. Ce sont ces cuisses qui régalent les Français, premiers consommateurs mondiaux de grenouilles.Au même titre que le camembert, les cuisses de grenouille sont en effet emblématiques de la cuisine française. Leur consommation dépasse pourtant les portes de l’Hexagone : on les retrouve dans d’autres pays européens, au Québec, aux Etats-Unis, aux Caraïbes.";fotolia_19355899_subscription_xxl-copy.jpg
https://www.academiedugout.fr/ingredients/ecrevisse-a-pattes-rouges_459;Ecrevisse à pattes rouges;L’écrevisse à pattes rouges, ou écrevisse à pieds rouges, de son nom scientifiqueAstacus astacus, est un crustacé d’eau douce originaire de l’Europe du nord. Comme son nom l’indique, ses pinces sont rouge vif. Ne pas la confondre avec l’écrevisse américaine, qui a également les pattes rouges. Ces dernières sont plus grosses, et leur goût est bien moins fin. Si l’écrevisse à patte rouge est une espèce en voie d’extinction, victime de la surpêche, il est toujours possible d’en consommer : on en trouve désormais d’élevage (on parle d’astaciculture).;fotolia_35323512_subscription_xl-copy.jpg
https://www.academiedugout.fr/ingredients/eglefin_484;Eglefin;Reconnaissable à sa tache noire au-dessus de sa nageoire pectorale, l’églefin (ou aiglefin) est un poisson d’eau de mer vivant le plus souvent à proximité des fonds marins nordiques ou atlantiques. Ce poisson rectiligne au corps fuselé présente une chair blanche légèrement rosée. Excellente source de protéines et surtout pauvre en gras, ce poisson proche parent du cabillaud révèle une chair assez fine et goûteuse.;eglefin-copy.jpg
https://www.academiedugout.fr/ingredients/encornet_482;Encornet;L’encornet est également connu sous deux autres noms : calmar ou calamar. Plus grand que sa cousine laseiche, l’encornet se caractérise par son corps fuselé terminé de dix tentacules et par une chair nacrée ferme et savoureuse. Idéal à farcir, l’encornet n’en demeure pas moins un ingrédient de choix pour sublimer légumes, sauces, et autres fricassées de fruits de mer.;encornet-copy.jpg
https://www.academiedugout.fr/ingredients/eperlan_485;Eperlan;« Friture d’éperlan », recette simple et rapide qui vient spontanément à l’esprit lorsque l’on évoque ce poisson de mer longiligne aux fines écailles argentées et à la chair savoureuse. Péché dans les estuaires des eaux froides ou tempérées, l’éperlan, qui est de la famille dusaumonet de la truite, a d’autres ambitions. Les quiches, gratins, soupes et risottos peuvent être son autre terrain de jeu.;eperlan-copy.jpg
https://www.academiedugout.fr/ingredients/escargot_899;Escargot;L’escargot est un mollusque, et bien qu’il habite uniquement la terre, il est de la famille des gastéropodes, comme le bulot et le bigorneau. Il en existe des dizaines d’espèces qui vivent à l’état sauvage sur toute la planète. Son corps, très mou, est constitué d’un large pied et d’une petite tête qui porte deux paires de tentacules et deux yeux. Le tout est surmonté d’une coquille en spirale ou colimaçon. En France, premier pays consommateur, les escargots sont décimés par la pollution, particulièrement par les pesticides utilisés dans l’agriculture. Ils sont encore nombreux en Europe de l’Est et dans des pays du Bassin méditerranéen. Certains viennent de l’héliciculture, nom que porte leur élevage.Tous sont hermaphrodites et pondent des œufs après leur accouplement.Ces œufs d'escargot sont généralement ceux des gros gris, recueillis par les éleveurs dans des salles de reproduction aménagées à cet effet. Les escargots pondent plutôt pendant l’été, à raison de 120 œufs environ chaque fois, soit 4 g, et plusieurs fois par an. Un œuf d’escargot a un diamètre de 4 mm, et est blanc et brillant. Les œufs sont recueillis, triés, puis nettoyés à la main. Ils sont ensuite soit pasteurisés, soit conservés dans une saumure.;escargot-solo-2_000.jpg
https://www.academiedugout.fr/ingredients/escargot-de-bourgogne_483;Escargot de Bourgogne;Variété d’escargot la plus répandue, l’escargot de Bourgogne est aussi l’espèce la plus goûteuse. Egalement surnommé «gros blanc », ce gastéropode qui arbore une coquille d’une couleur ocre est l’ingrédient principal d’un plat populaire : les escargots à la bourguignonne. Préparation agrémentée d’ail, de beurre et de persil qui ferait presque oublier que l’escargot de Bourgogne peut s’associer à des fromages comme le chèvre ou le roquefort ou à des épices tels que le gingembre ou à de la volaille. Une reconversion lente mais sûre.;escargots-bourgogne-copy.jpg
https://www.academiedugout.fr/ingredients/espadon_900;Espadon;L’espadon est un énorme poisson, très rapide, particulièrement recherché par les amateurs de pêche sportive. Mais parce qu’ils se ressemblent beaucoup, on le confond souvent avec le marlin. L’espadon est un poisson dit « osseux », qui pèse de 100 à 400 kg, pour une longueur de 2 à 3 m. Sa tête est prolongée par un très long bec, le rostre, qui fait près du tiers de sa longueur totale. Il vit en solitaire dans l’Atlantique, mais aussi en Méditerranée, loin des côtes. Sa chair est fine, proche de celle du thon, mais sa saveur est peu prononcée. Le marlin se décline en différentes espèces : le marlin bleu et le marlin noir, qui vivent dans l’Atlantique sud, le marlin rayé, que l’on pêche dans le Pacifique et l’océan Indien, le marlin méditerranéen (de la mer du même nom), qui est très proche de l’espadon.Tous se pêchent « au gros », à la palangre ou au harpon. La pêche de l’espadon est soumise à des quotas dans certains pays afin de protéger l’espèce.;espadon_000.jpg
https://www.academiedugout.fr/ingredients/lieu-jaune_486;Lieu jaune;Le lieu jaune est un poisson de la famille desGadidae, pêché sur le long des côtes européennes (Atlantique, mer du Nord, Baltique et Méditerranée). Il est reconnaissable à ses trois nageoires dorsales ainsi qu'à sa robe argentée rayée d'une ligne vert-olive sur son dos et pigmentée de jaune sur le ventre. Sa chair blanche est proche de celle du cabillaud et ne contient que peu d'arêtes. La saveur délicate du lieu jaune plaît à tous les palais. Poisson maigre, il est constitue une bonne source de phosphore et de vitamines B.;fotolia_62688233_subscription_xxl-copy.jpg
https://www.academiedugout.fr/ingredients/lieu-noir_904;Lieu noir;"Le lieu noir appartient à la famille des gadidés tout comme lelieu jaune. Ce poisson au corps fuselé est souvent appelé « colin » en France, ce qui sème la confusion puisque ""colin"" peut également désigner le merlu. Il vit dans tout l’Atlantique nord. Sa ligne latérale est très claire, presque blanche. La couleur de son dos varie entre le brun verdâtre et le gris foncé noirâtre. Son ventre est gris argenté. Sa taille varie de 30 à 80 cm. Sa chair est moins fine que celle du lieu jaune, plus ferme, mais aussi plus sèche. Au Canada, il se nomme « goberge » et est transformé en surimi.";lieu_000.jpg
https://www.academiedugout.fr/ingredients/limande_468;Limande;La limande est un poisson plat, cousine de la sole, du turbot ou encore ducarrelet. Elle est reconnaissable à ses yeux rapprochés situés d'un même côté. La limande est pêchée au chalut de la mer de Nord jusqu'au golfe de Gascogne. Moins onéreuse et raffinée que la sole, la limande est un poisson à chair maigre, bien pourvu en protéines et oligo-éléments (iode notamment).;fotolia_55214657_subscription_xxl-copy.jpg
https://www.academiedugout.fr/ingredients/maquereau_895;Maquereau;"Le corps d'un maquereau est fuselé, sa peau est bleu-vert zébrée de noir sur le dos et argentée sur le ventre. La taille d’un maquereau varie entre 30 et 40 cm et son poids entre 500 g et 1 kg. Sa chair est savoureuse, assez forte en goût et assez grasse. Ce poisson grégaire vit en bancs ; il passe l’été dans les eaux froides, et à l’automne, il migre vers des eaux plus chaudes.";maquereau_000.jpg
https://www.academiedugout.fr/ingredients/merlan_469;Merlan;Le merlan est un poisson à chair maigre, fine et feuilletée, vivant dans les fonds rocheux de la mer du Nord et de l'Atlantique. Poisson carnivore, le merlan appartient à la famille des gadidae, tout comme son cousin le lieu. Il est riche en vitamines B3, B12, D, en phosphore ainsi qu'en magnésium. Son goût délicat et sa texture légère plait généralement aux enfants.;fotolia_57227554_subscription_xxl-copy.jpg
https://www.academiedugout.fr/ingredients/fletan_460;Flétan;"C’est le plus gros des poissons plats. C’est aussi l’un des meilleurs ; il est fort recherché, donc trop capturé. Sa pêche est à présent soumise à des quotas dans presque tous les pays. Ses yeux sont tous deux situés sur le côté droit de sa tête. Il est donc aveugle du côté gauche. Cette face de son corps est blanche ou grise, tandis que l’autre est brune, parfois presque noire. Sa peau, lisse, est couverte d’écailles rondes. Il possède une queue fourchue.En Amérique du Nord, sa pêche a commencé dans les années 1820, surtout dans la région de Cape Cod et dans la baie du Massachusetts. Puis, pour faire face à une demande croissante, elle a migré vers la haute mer, et enfin dans l’Atlantique nord. Devenue intensive, cette pêche est soumise à des quotas depuis quelques années. Cette mesure est justifiée pour éviter la disparition du flétan car, si les femelles sont très prolifiques (elles peuvent libérer plusieurs millions d’œufs pendant la période de frai, entre février et mai), ce poisson n’a pas une croissance rapide : les mâles atteignent leur maturité entre 7 et 11 ans, avec une taille de 66 à 100 cm, et les femelles, entre 10 et 12 ans.";fotolia_57816927_subscription_xxl-copy.jpg
https://www.academiedugout.fr/ingredients/gambas_461;Gambas;"Derrière le mot ""gambas"" se cache lesAristeidae, une famille de crustacés apparentées auxcrevettesmais de taille supérieure. C’est de la langue espagnole que vient le terme de gambas, aujourd’hui utilisé dans la langue française pour designer plusieurs espèces. Les gambas (parfois nommées crevettes géantes) ont une chair fine et savoureuse, et sont généralement pêchées dans les eaux profondes de la Méditerranée ou de l’Atlantique.";fotolia_50201017_subscription_xxl_clipped_rev_1.png
https://www.academiedugout.fr/ingredients/gamberoni_462;Gamberoni;Le gamberoni est un crustacé rare proche des gambas. Cette grosse crevette se trouve dans les eaux du Golfe de Gênes (Italie) à 400 mètres de profondeur, dans l'Atlantique Est (de la Sierra Leone au Maroc) ainsi que dans l'Atlantique Ouest (du golfe du Mexique à la Caroline du sud). C’est une espèce protégée dans certaines zones, par exemple à Mayotte, où il est interdit de l’élever, de la pêcher et de la commercialiser.;fotolia_28749122_subscription_xl-copy.jpg
https://www.academiedugout.fr/ingredients/hareng_950;Hareng;Le hareng est un poisson des mers froides. Son corps est fuselé, son dos bleuâtre avec des reflets verts et son ventre argenté. Il mesure rarement plus de 30 cm. Il vit en bancs dans l’Atlantique nord, le Pacifique nord et toutes les mers de l’Europe du Nord. Le hareng, frais, salé ou saur (salé et fumé), fut pendant des siècles un pilier de l’alimentation. Largement consommé dans toute l’Europe du Nord, il joua un grand rôle économique, servant de monnaie d’échange, de cadeau, et parfois même de rançon ! Le hareng est l’un des poissons qui ont été le plus capturés. Sa pêche est désormais réglementée dans de nombreux pays. Ceux de la Communauté européenne se voient attribuer des quotas chaque année.;hareng_000.jpg
https://www.academiedugout.fr/ingredients/king-crab_465;King crab;Le king crab – ou crabe royal – doit son nom à son envergure pouvant atteindre les 2,5 mètres. Il ressemble à une araignée de mer géante et est pêché dans les eaux froides situées entre la Russie et l'Alaska. Sa chair d'une grande finesse et son goût très doux sont prisés des gastronomes. Le king crab est riche en zinc, cuivre, sélénium et vitamines B12. Il est également bien pourvu en phosphore, magnésium et fer.;fotolia_17640210_subscription_xl-copy.jpg
https://www.academiedugout.fr/ingredients/kombu_466;Kombu;Le kombu – ou laminaire – est une algue géante qui s'épanouit dans les mers froides. Elle est principalement récoltée en Asie et est très consommée au Japon, en Chine et en Corée. Les côtes bretonnes produisent également du kombu royal. Algue bienfaisante, le kombu est concentré en oligo-éléments (iode notamment). Détoxifiante, elle permet de lutter contre la rétention d'eau. Sa richesse en fibres fait d'elle un excellent coupe-faim.;fotolia_53437174_subscription_xl-copy.jpg
https://www.academiedugout.fr/ingredients/langouste_914;Langouste;La langouste, crustacé décapode, vit sur les fonds rocheux de toutes les eaux chaudes de la planète. Son corps, revêtu d’une carapace très épineuse, est composé de deux parties : le coffre (sa tête et son thorax), où se trouvent les dents, les yeux, deux longues antennes très fragiles et quatre paires de pattes, et la queue (son abdomen), articulée et munie de deux pattes plates nageuses. C’est la queue, qui renferme une belle chair assez ferme particulièrement savoureuse et fine, qui fait de la langouste un produit remarquable. C’est une cousine du homard mais elle n’a pas de pinces, seulement des pattes peu riches en chair.;langouste_000.jpg
https://www.academiedugout.fr/ingredients/moules-de-bouzigues_488;Moules de Bouzigues;La moule de Bouzigues est une moule dite méditerranéenne plus grosse et plus charnue que la moule présente sur les côtes bretonnes et dans le nord de l’Europe. Ces mollusques bivalves sont cultivées dans le bassin de Thau situé dans le Languedoc-Roussillon et qui borde Bouzigues, petit village de pêcheurs spécialisé dans l’élevage d’huîtres et de moules. Leur coquille plus angulaire renferme une chair jaune orangée à la saveur plus iodée et davantage corsée.;moule-bouzigues-copy.jpg
https://www.academiedugout.fr/ingredients/mulet_878;Mulet;Sous le nom de « mulet » se regroupe un grand nombre d’espèces de poissons qui se ressemblent beaucoup : un corps fuselé gris argenté recouvert d’écailles épaisses et une grosse tête dont la morphologie varie un peu selon l’espèce. Il y a des mulets dans toutes les mers mais aussi dans les estuaires et même dans certains cours d’eau car ils ont la particularité de pouvoir évoluer aussi bien dans une eau salée que dans une eau douce. Ils vivent en hiver en pleine mer puis remontent au printemps vers les estuaires et les ports pour se nourrir. Les mulets sont dotés d’un système digestif qui leur permet de tout avaler que ce soit du plancton, des algues ou même de la vase. Ils pèsent de 1,5 à 8 kg et ont une taille moyenne de 30 à 50 cm.;mulet_000.jpg
https://www.academiedugout.fr/ingredients/oursin_861;Oursin;Le mot « oursin » vient du grecekhinosqui signifie « hérisson ». D’ailleurs, l’oursin se nomme aussi « hérisson de mer » ou « châtaigne de mer ». On le range dans la catégorie des coquillages mais l’oursin n’en est pas un. C’est un invertébré de la famille des échinodermes qui vit dans toutes les mers du monde. Il est formé d’une coque calcaire, appelée « test », hérissée de piquants longs de 2 à 10 cm selon les espèces. D’un côté se trouve sa bouche, munie de toutes petites dents, et de l’autre son anus. À l’intérieur se situent ses systèmes digestif et aquifère et ses cinq glandes sexuelles disposées en étoile appelées familièrement « corail » ou « langues » : c’est ce que l’on consomme après avoir ouvert l’oursin. Ces langues sont de couleur crème ou orange selon que l’oursin est femelle ou mâle.;oursin_000.jpg
https://www.academiedugout.fr/ingredients/perche_489;Perche;La perche est un poisson d’eau douce gris irisé de vert qui peut mesurer jusqu’à 60 cm. Il se nourrit essentiellement de petits poissons et de crustacés. Parmi les poissons vivant dans les rivières et les étangs, la perche est considérée comme étant l’un des plus fins. Sa chair ferme et savoureuse renferme des protéines, des vitamines et des minéraux bénéfiques pour la santé. Seul bémol : la perche est un poisson qui contient beaucoup d’arêtes.;filet-perche-copy.jpg
https://www.academiedugout.fr/ingredients/pibales_689;Pibale (civelle);Les pibales ou civelles, sont des alevins d’anguilles nés en mer des Sargasses dans les caraïbes. Les estuaires du golf de la Gascogne sont le point de chute de leur migration qui dure plus de 8 mois. Ces petits poissons transparents se retrouvent donc dans les rivières ou les fleuves afin d’atteindre l’âge adulte. Autrefois considéré comme « le plat du pauvre » en raison de son abondance, les civelles dont la chair est fine et savoureuse est désormais un mets recherché et onéreux.;pibales-ok-copy.jpg
https://www.academiedugout.fr/ingredients/poulpe_804;Poulpe;Le poulpe est une pieuvre, dont il existe des centaines d'espèces, ce terme de poulpe est une appellation commerciale et culinaire. Le poulpe est un invertébré marin de la famille des céphalopodes que l'on reconnaît à ses 8 tentacules de taille égale, bordés de deux rangés de ventouses. Ce mollusque sans coquille, considéré comme l'un des plus intelligents de son genre, mesure entre 5 cm et 3 mètres de long. Les Espagnols, Portugais et Japonais en sont très friands. Aux Antilles, le poulpe est nommé « chatrou ». A la Réunion, il prend le nom de« zourit ».;poulpe_000.jpg
https://www.academiedugout.fr/ingredients/poulpe-de-roche_805;Poulpe de roche;Le poulpe de roche appartient à la famille des céphalopodes. Cet invertébré marin se reconnaît à sa couleur rouille qui lui permet de se confondre avec son environnement rocheux. Il est notamment péché dans les calanques, le long des côtes méditerranéennes. Il est plus petit et tendre que le poulpe de sable, à la couleur beige, mais possède tout comme lui huit tentacules bordés de deux rangées de ventouses.;fotolia_19877098_subscription_xxl-copy.jpg
https://www.academiedugout.fr/ingredients/raie_1010;Raie;"Bien que ça ne soit pas du tout un oiseau, c'est le plus souvent sous le nom ""d'aile"" que la raie est vendue, du moins en France. Ce poisson aplati et cartilagineux, en forme de losange, a un petit corps et de très grandes nageoires, charnues, en forme d'aile et ce sont elles que l'on consomme. Selon les espèces, l'envergure d'une raie va de 30 cm à plus de 6 mètres.";raie_000.jpg
https://www.academiedugout.fr/ingredients/rascasse_695;Rascasse;La rascasse est une variété de poissons de roche vivant dans les profondeurs que l’on trouve notamment en mer Méditerranée. Ce poisson est reconnaissable à sa tête plutôt disgracieuse et aux épines qui parsèment son corps. D’ailleurs, le nom rascasse vient du mot provençal « rascous » qui signifié « rugueux », « teigneux ». Sa chair blanche est assez ferme.;fotolia_45709372_subscription_xxl.jpg
https://www.academiedugout.fr/ingredients/roussette_717;Roussette;La roussette fait partie de la famille des requins. Ce poisson à la peau tachetée, au corps longiligne et à la tête aplatie est pêché principalement dans l’Atlantique mais aussi en Méditerranée. Ce petit requin a une chair ferme qui ne contient aucune arête, seul un cartilage central est présent. Une particularité qui ravira sans conteste parents et enfants.;fotolia_45788869_s-copy.jpg
https://www.academiedugout.fr/ingredients/saint-pierre_1202;Saint-Pierre;"Le Saint-Pierre est un poisson ovale et aplati qui se caractérise par de gros yeux placés très haut et une mâchoire proéminente. Son autre particularité : ses deux points noirs qui se situent de part et d'autre de son corps. A cause de sa peau bronze aux reflets argentés, il s'appelle aussi ""Doré"" ou ""Jean-Doré"" (John-Dory en anglais). Sa taille évolue entre 30 et 50 cm mais il peut en atteindre 80. Il vit dans toutes les mers du monde. Le Saint-pierre, poisson assez rare, a une chair particulièrement délicate et savoureuse.";saint-pierre_v2_000.jpg
https://www.academiedugout.fr/ingredients/salicorne_406;Salicorne;Salicorne, passe-pierre ou haricot de mer, autant de noms pour désigner cette plante sauvage comestible qui pousse dans les prés salés de la Baie de Somme et plus généralement sur le littoral atlantique. On la reconnaît à ses petites ramifications renflées et à son goût iodée. La salicorne, récoltée par les pêcheurs à pied, se consomme crue ou cuite et se cuisine comme les haricots verts. Ce légume de mer croquant riche en vitamine et en oligo-éléments est sans conteste un aliment à découvrir.;salicorne-copy.jpg
https://www.academiedugout.fr/ingredients/sardine_491;Sardine;Populaire au Moyen-Age avant de devenir un mets d’exception et onéreux au XIX ème siècle, la sardine redevient accessible et populaire au début du XXème siècle avec la prolifération des conserveries. Acheté frais ou en conserve, à l’huile ou nature, ce poisson bleu argenté riche en oméga 3 est une source exceptionnelle de protéines, de fer et de calcium. La sardine offre de plus de multiples possibilités en cuisine : elle peut être grillée, poêlée, farcie ou frite.;sardine-copy.jpg
https://www.academiedugout.fr/ingredients/saumon-fume_474;Saumon fumé;Si le saumon se consomme parfois cru (dans la gastronomie japonaise par exemple) ou cuit, il s’apprête aussi fumé. On utilise alors le filet du poisson qu’on sale pendant quelques heures avant de le fumer à 30°C en l’exposant à la fumée d’un feu de bois. Tel qu’on le connaît en Europe, le saumon fumé est préparé avec l’espèce Salmo Salar, issue de l’Atlantique. Mais le saumon royal (ou chinook) est également fameux lorsqu’il est fumé.;fotolia_48010408_subscription_xxl.jpg
https://www.academiedugout.fr/ingredients/sole_1216;Sole;Poisson plat, la sole est d'un ovale presque parfait. D'un côté sa peau est blanc crème, de l'autre elle est brune et c'est de ce côté que sa tête porte ses yeux. Adulte, lorsqu'elle est capable de se reproduire, elle mesure de 32 à 35 cm. Mais si elle échappe à la capture, elle peut vivre suffisamment longtemps pour atteindre 70 cm. Elle vit dans l'Atlantique, des côtes françaises jusqu'au Sénégal. Il y en a un peu en Méditerranée et dans le Pacifique. C'est une cousine de laplieet de lalimande. Dans les pays où la sole n'est pas pêchée, ces poissons sont souvent appelés sole.;sole_000.jpg
https://www.academiedugout.fr/ingredients/uf-de-saumon_472;Œuf de saumon;Les œufs de saumon sont des œufs de poisson qui proviennent des femelles saumon. De couleur orange avec un goût iodé, ces œufs sont un peu plus gros que lesœufs de lump. Les principaux pays producteur sont les Etats-Unis et le Canada.;fotolia_62175250_subscription_xxl-copy.jpg
https://www.academiedugout.fr/ingredients/supions_492;Supions;En Provence, le terme « supions » renvoie aux très petitesseichesqui peuplent le fond sablonneux de la mer Méditerranée. Ces céphalopodes apparentés à la famille des seiches (espèce voisine des calmars) ne mesurent pas plus de 5 cm. Munie de dix tentacules dont deux très longues terminées par des ventouses lui servant à capturer sa proie, les supions sont l’un des ingrédients phares de la cuisine provençale.;fotolia_23338358_subscription_xl.jpg
https://www.academiedugout.fr/ingredients/surimi_477;Surimi;Le surimi, autrefois appelé kamaboko, provient d’une tradition japonaise ancestrale qui a laissé sa place à une fabrication industrielle. Ces bâtonnets, faits à partir de la chair de différents poissons blancs, est très prisé par les enfants et les personnes qui font attention à leur ligne. Il a l’avantage de ne pas nécessiter de préparation et de se prêter à de nombreux accommodements.;fotolia_62552098_subscription_xl-copy.jpg
