URL;Titre;Description;ImageFilename
https://www.academiedugout.fr/ingredients/cabillaud_838;Cabillaud (ou morue);Cabillaud ou morue ? Ces deux noms désignent un même poisson qui appartient à la famille des gadidés. Une aimable confusion règne à ce sujet, essentiellement en France. En matière de gastronomie, le terme « cabillaud » s’applique au poisson frais (ou surgelé), et il devient « morue » quand il est salé et parfois séché (il peut aussi s’appeler «stockfish» dans ce cas). Mais… le cabillaud se nomme aussi souvent « morue fraîche ». En matière de pêche, le nom de « cabillaud » désigne parfois les grosses morues qui ont survécu à la pêche intensive, tandis que le terme « morue » s’applique à des poissons plus jeunes et plus petits.;cabillaud_000.jpg
https://www.academiedugout.fr/ingredients/corail_454;Corail;On appelle « corail » la partie rouge-orangée, solidaire de lanoix de Saint-Jacques. Il s'agit de l'organe reproducteur de la coquille Saint-Jacques. Durant la période de reproduction de ce coquillage, les œufs se développent dans la partie « femelle » du corail. La texture du corail diffère de celle de la noix de Saint-Jacques. Elle est moins ferme, plus granuleuse. Le corail est également plus riche en protéines et lipides que la noix. Sa saveur prononcée est prisée des gourmets.;fotolia_47877573_subscription_xl-copy.jpg
https://www.academiedugout.fr/ingredients/crevette_886;Crevette;"La crevette fait partie des décapodes marcheurs, famille qui rassemble aussi le crabe, le homard, la langouste et la langoustine. Elle se trouve dans toutes les mers du monde, et il en existe environ 2 000 espèces. Le corps d’une crevette comprend deux parties : - le céphalothorax, communément nommé la « tête » ; là se trouvent les dents, les organes sensitifs (yeux et antennes) et quatre paires de pattes marcheuses qui lui permettent de se déplacer sur les fonds sableux ; la première paire de ces pattes se termine par des pinces plus ou moins développées selon les espèces ; - l’abdomen, que l’on appelle habituellement la « queue » ; c’est la partie comestible ; il est articulé et muni de deux pattes nageuses. Le tout est recouvert d’une carapace dont la couleur varie selon les espèces. La crevette fait l’objet d’une pêche intense et industrielle. Elle est tout aussi intensément élevée en aquaculture.";crevette_000.jpg
https://www.academiedugout.fr/ingredients/ecrevisse_893;Ecrevisse;L’écrevisse est un crustacé, mais c’est le seul qui vit en eau douce. Cet animal invertébré, cousin du homard, est recouvert d’une carapace dont la couleur change lors de la cuisson. L’écrevisse possède cinq paires de pattes qui lui permettent de se déplacer rapidement, dont une paire redoutable, très développée, composée d’un étau d’un côté et d’une pince en dents de scie de l’autre avec laquelle elle attrape et broie aussitôt sa nourriture. La taille moyenne d’une écrevisse se situe entre 12 et 15 cm.En Europe, la pêche à l’écrevisse est très réglementée. Dans de nombreuses régions, afin de protéger les espèces autochtones, seule la pêche des espèces invasives (américaine, de Louisiane, de Californie) est autorisée toute l’année. Il est, par ailleurs, interdit de les transporter vivantes. La pêche des espèces autochtones et protégées est autorisée pendant 1 semaine ou 2 en juillet.;ecrevisse_000.jpg
https://www.academiedugout.fr/ingredients/encre-de-seiche_336;Encre de seiche;L’encre de seiche, aussi appelée sepia, est un liquide riche en mélanine présent dans la poche de la seiche que cette dernière éjecte pour se protéger et s’extraire de situations dangereuses. A l’origine arme de défense utilisée contre ses prédateurs, l’encre de la seiche a une tout autre fonction en gastronomie : donner une petite touche d’originalité en colorant de manière naturelle des plats aussi bien sucrés que salés. Une coloration noire profonde avec un goût peu marqué qui égayera sans appel bon nombre de recettes.;encre-de-seiche-copy.jpg
https://www.academiedugout.fr/ingredients/homard_946;Homard;Le homard est un crustacé dit « décapode » parce qu’il possède dix pattes. Recouvert d’une carapace articulée, son corps est divisé en deux parties : le céphalothorax (ou tête, ou coffre) et l’abdomen (la queue). Dans le coffre se trouvent les dents, les yeux, deux longues antennes lui permettant de détecter sa nourriture et cinq paires de pattes marcheuses. La première paire se termine par des pinces très développées, avec lesquelles il broie et décortique ses proies, qui contiennent de la chair. Ce coffre renferme une partie crémeuse, le corail. La queue, partie comestible contenant une chair ferme et savoureuse, est munie de deux pattes plates nageuses. Elle est articulée et formée de sept sections. Le homard vit de 6 à 10 ans avant d’atteindre sa taille commerciale : 30 cm de longueur en moyenne (soit 500g). Il subit une vingtaine de mues chaque fois que sa carapace devient trop petite et consomme cette dernière qui lui fournit le calcium nécessaire pour en reconstituer une nouvelle.;homard_000.jpg
https://www.academiedugout.fr/ingredients/huitre_944;Huître;L’huître est un mollusque bivalve composé d’une coquille très dure, de forme variable selon l’espèce, et d’un corps mou recouvert d’un manteau (cette membrane qui bouge lorsqu’on la pique ou qu’on verse une goutte de jus de citron ou de vinaigre dessus). Ce corps est relié à la coquille par un muscle adducteur qui la maintient fermée. À l’intérieur se trouvent les branchies, le système digestif et le cœur.;huitre_000.jpg
https://www.academiedugout.fr/ingredients/langoustine_467;Langoustine;La langoustine fait partie de la famille des décapodes marcheurs. C’est la cousine du crabe, de la crevette, du homard et de lalangouste. La langoustine est un petit crustacé aux longues pinces et non une langouste miniature. La langoustine est principalement pêchée en Atlantique nord, Méditerranée et mer du Nord. Sa longueur (avec pinces) varie de 10 à 25 cm. Sa couleur peut aller du beige au rouge brique. Sa chair légère et corsée a une saveur proche de celle du homard. Riche en calcium, fer et phosphore, la langoustine est peu calorique lorsqu'elle est consommée sans sa tête.;fotolia_54720268_subscription_xl-copy.jpg
https://www.academiedugout.fr/ingredients/moule_883;Moule;Une moule est un coquillage bivalve composé de deux coquilles noires ovales se terminant en pointe qui abritent et protègent son corps orange et mou. Celui-ci est recouvert d’un manteau qui contient les branchies, les organes viscéraux, un muscle, un pied et un byssus, faisceau de filaments qui lui permettent de s’accrocher à un rocher ou tout autre support. La moule filtre plusieurs litres d’eau par heure, ce qui en fait un coquillage particulièrement sensible aux polluants de toutes sortes. Les moules vivent en bancs, qu’on appelle des moulières. Il y en a dans toutes les mers.;moules_000.jpg
https://www.academiedugout.fr/ingredients/rouget_1033;Rouget;"Ce terme de rouget prête souvent à confusion car il s'applique souvent à deux familles différentes de poissons, celle du vrai rouget, le rouget-barbet (familleMullus) et celle du grondin (famille Triglidés) dont un de ses membres, le Grondin perlon est brun rouge. Le rouget-barbet est un poisson d'une longueur de 15 cm en moyenne (mais il peut en atteindre 30) dont le corps, recouvert d'écailles assez larges, passe du rose à l'orangé pour devenir rougeâtre après sa mort. Sous sa tête dont le museau est écrasé, il porte deux barbillons, d'où le terme ""barbet"" accolé au mot ""rouget"".";rouget_000.jpg
https://www.academiedugout.fr/ingredients/saumon_1214;Saumon;Le saumon, ce poisson à la chair rose, a une vie plutôt particulière car elle se déroule dans deux eaux, la douce et la salée alors que la grande majorité des poissons vivent dans l'une ou dans l'autre. Il se reproduit et passe sa petite enfance dans l'eau douce et, quand il est en âge, vers deux ans, il s'en va vivre dans l'autre, celle de l'Atlantique ou du Pacifique pendant quelques années. Puis il revient sur son lieu de naissance : s'il est femelle, il pond, s'il est mâle, il bataille avec les autres pour lâcher sa semence sur les œufs fraîchement pondus. Mais, pour beaucoup, cette vie est beaucoup moins aventureuse car elle se déroule entièrement dans une ferme aquacole. D'où la distinction entre les deux produits : le saumon sauvage et le saumon d'élevage. Et comme l'un et l'autre sont aussi traités par salage et fumage, un troisième produit en découle, lesaumon fumé.;saumon_000.jpg
https://www.academiedugout.fr/ingredients/thon-jaune-albacore_480;Thon jaune (albacore);Le thon « albacore », également appelé thon jaune ou encore yellowfin, ne doit pas être confondu avec le thon dit « blanc », legermon. Dans les pays anglophones, c’est ce dernier que l’on appelle « albacore ». De jaune, le Thunnus albacares n’a que les nageoires, sa chair étant rouge. C’est un poisson particulièrement apprécié des pêcheurs sportifs car c’est une cible d’une grande force, difficile et résistante. Sa taille moyenne avoisine les 1,5 m.;thon-jaune-copy.jpg
https://www.academiedugout.fr/ingredients/colinot_452;Colinot (Merlu);Le colinot, ou colineau, est un poisson marin appartenant à la famille des Merlucciidae. Il est également commercialisé sous le nom de « merlu » ou de « bardot » selon les régions. Le colinot se reconnaît notamment à ses deux nageoires dorsales et à sa gueule dotée de minuscules dents. Sa taille varie de 15-20 cm pour les plus jeunes spécimens à plus d'un mètre pour les adultes. Seuls les individus de plus de 27 cm peuvent être prélevés. Son goût peu marqué en fait un poisson apprécié des enfants.;fotolia_57227554_subscription_xxl-copy.jpg
https://www.academiedugout.fr/ingredients/brochet_832;Brochet;Le brochet est un poisson d’eau douce au corps fuselé, marbré de vert ou de brun sur le dos, et au ventre blanc. Il est couvert de fines écailles. Sa tête, allongée, possède une mâchoire munie de dents très acérées. Il vit dans les fleuves, les rivières et les lacs d’Europe, d’Amérique du Nord, d’Asie et aussi du Maroc. Sa chair est particulièrement fine, mais très fournie en arêtes tout aussi fines.Nul ne sait pourquoi le brochet possède autant de surnoms selon les pays ou les régions où il vit : broc, bec, bec-de-canard, gros bec, béquet, brocheton, brochette, brouché, buché, filaton, flute, goulu, grand-bec, grand-gousier, lanceron, lançon, luceau, pognan, pogneau, poignard, sifflet, gobe poisson, fusil, requin de rivière ou d’eau douce. Mais dans beaucoup de pays, dont la France, le brochet est en voie de disparition en raison de la pollution des eaux, du bétonnage des rives de certains cours d’eau et de la destruction trop fréquente de ses lieux de reproduction ‒ dame brochet s’en va déposer ses œufs entre février et avril dans les herbes humides au bord des berges. Dans les Dombes, en France, des élevages existent afin de repeupler les rivières.;brochet_000.jpg
https://www.academiedugout.fr/ingredients/seiche_475;Seiche;La seiche commune (sepiida) est un mollusque, plus précisément un céphalopode décapode, mesurant généralement une trentaine de centimètres. Elle possède un os qui leur permet de flotter, une tête munie des petits bras ventousés et deux tentacules. Grâce à son « siphon », elle peut projeter un liquide noir lorsqu’elle se sent menacée : c’est l’encre de seiche, qui sert de colorant en cuisine. On en trouve sur les côtes françaises jusqu’à 100 mètres de profondeur.;fotolia_23338475_subscription_xl.jpg
https://www.academiedugout.fr/ingredients/praire-ou-palourde_807;Praire (palourde);La palourde et la praire sont des mollusques bivalves vivant dans les fonds vaso-sableux du littoral normand et breton (Granville, Erquiy, Brest). Leur coque présente des stries concentriques. Elles sont pêchées à la faveur des marées, de la fin de l'automne au début du printemps. Leur prise est réglementée. Seuls les spécimens de plus de 4 cm peuvent être prélevés. Riches en oméga 3 et en fer, la praire et la palourde sont également bien pourvues en zinc, sélénium et phosphore.;fotolia_57063037_subscription_xxl-copy.jpg
https://www.academiedugout.fr/ingredients/haddock_463;Haddock;Reconnaissable à sa tache noire au-dessus de sa nageoire pectorale, l’églefin(ou aiglefin) est un poisson d’eau de mer vivant le plus souvent à proximité des fonds marins nordiques ou atlantiques. Ce poisson rectiligne au corps fuselé présente une chair blanche légèrement rosée. Lorsque l’églefin est fumé et salé ou saumuré, on le retrouve commercialisé sous le nom de haddock. Généralement, il est teint au rocou, un colorant végétal (également utilisé pour colorer la mimolette) qui lui donne sa couleur orangée.;fotolia_45066102_subscription_xl-copy.jpg
https://www.academiedugout.fr/ingredients/anchois_827;Anchois;"Le terme générique d’""anchois"" regroupe un grand nombre de petits poissons de la famille des engraulidés. Ils mesurent de 10 à 20 cm et vivent en bancs dans presque toutes les mers du monde, près des côtes. Leur dos est bleu-vert, leurs flancs argentés, et ils sont couverts de grandes écailles. Ils se reproduisent très vite et très souvent : deux à trois fois par an. Ils grandissent rapidement : à l’âge de 1 an, ils sont adultes. Mais ils vivent peu de temps car, dans les mers européennes, ils sont surpêchés et sont devenus une espèce en danger.";anchois_000.jpg
https://www.academiedugout.fr/ingredients/anguille_449;Anguille;L’anguille ressemble furieusement à un serpent. Elle mesure en moyenne 60 cm. Sa peau, très épaisse, est visqueuse. Une puissante mâchoire garnie de nombreuses petites dents, indices de sa voracité, occupe une grande partie de sa tête.C’est un poisson d’eau douce mystérieux car il va se reproduire (et mourir) dans les profondeurs maritimes à des milliers de kilomètres de son lieu de vie que sont les cours d’eau. Les larves flottent ensuite jusqu’à ce qu’elles retrouvent les côtes où vivaient leurs parents, et prennent le nom de civelles ou de pibales lorsqu’elles y arrivent.;fotolia_48936411_subscription_xxl-copy.jpg
https://www.academiedugout.fr/ingredients/bar_820;Bar (Loup);Ce poisson rond porte deux noms différents : il se nomme bar lorsqu’il vit et est pêché dans l’océan Atlantique, et loup dans la Méditerranée. Ce nom de « loup » vient de sa voracité. En effet, le bar ouvre la bouche en nageant et se gave de tout ce qui lui tombe sous les nageoires et qui n’est pas du plancton : sardines, anchois, bébés mulets, nouveau-nés d’anguilles, calmars, petits crabes, crevettes et tous les crustacés rencontrés, du moment qu’ils sont plus petits que lui.Adulte, le bar est plutôt un poisson solitaire, tandis que les jeunes vivent en bans. Ceux-ci peuvent être saisis d’une frénésie alimentaire féroce, et l’on voit alors la mer bouillonner de poissons qui en assomment d’autres d’un coup de queue pour mieux avaler leur proie. L’été, le bar aime vivre près des côtes rocheuses et des plages à vagues déferlantes. Il est alors capturé à la ligne par des pêcheurs individuels. Les professionnels le pêchent en haute mer, soit à la ligne, soit au filet.;bar_000.jpg
https://www.academiedugout.fr/ingredients/lotte_822;Lotte (baudroie);Ce poisson n’a pas d’arêtes, mais une énorme tête, très laide, hérissée d’épines, boursouflée, avec des yeux proéminents placés sur le dessus et une immense bouche peuplée de dents pointues et menaçantes. C’est ce qui explique que, pour la majorité des baudroies, cette abominable tête soit toujours détachée. Seul alors le corps allongé, presque cylindrique, recouvert d’une peau lisse, sans écailles, un peu visqueuse, est commercialisé, et il devient une queue de lotte.;lotte_000.jpg
https://www.academiedugout.fr/ingredients/calmar_840;Calmar (ou calamar);Le calmar et la seiche appartiennent à la même famille, celle des céphalopodes décapodes, ces mollusques sans coquille qui possèdent dix tentacules. Ils sont cousins, mais bien que, régionalement, ils portent parfois le même nom, ils sont différents et pas vraiment constitués de la même façon. « Calmar » ou « calamar », les deux noms sont valables. Mais « encornet » l’est aussi. Sur la côte basque, c’est un « chipiron », dans le midi de la France, il est « supion » ou « piste », et en Italie il est « calamaretti » (quand il est petit). Il a un corps allongé, deux nageoires, une petite tête munie d’un bec dur et dix tentacules équipés de ventouses. Son corps, appelé « manteau », est recouvert d’une membrane noirâtre. La tête contient une poche à encre. La taille du calmar évolue de 10 à 50 cm. Plus de 300 espèces sont répertoriées, qui vivent dans tous les océans et les mers de la planète, le plus souvent en bans, certains près des côtes, d’autres dans les profondeurs sous-marines.En France, les calmars sont pêchés toute l’année, mais les meilleures saisons sont mars et mai ainsi qu’octobre et novembre dans la Manche et la mer du Nord, septembre à décembre dans l’Atlantique, septembre à avril en Méditerranée.;calamar-seiche_000.jpg
https://www.academiedugout.fr/ingredients/daurade_887;Daurade (dorade);C’est une famille compliquée que celle de la dorade, surtout en France où elle a droit à deux orthographes : « dorade » et « daurade » quand elle est royale. C’est un poisson ovale au corps protégé d’écailles très épaisses aux reflets argentés. Il en existe pas moins de 16 variétés de couleurs différentes allant du gris au rose.;daurade_000.jpg
https://www.academiedugout.fr/ingredients/morue_487;Morue;La morue n’est autre que du cabillaud séché et/ou salé. Le cabillaud a une chair blanche très goûteuse que le salage et le séchage n’altèrent en rien. Etant du cabillaud, la morue est par conséquent un poisson très pauvre en calories et en lipides qui s’adapte à différents modes de cuisson et s’apprête surtout comme n’importe quel autre poisson. Il convient juste de la faire dessaler avant cuisson afin que l’excès de sel ne gêne sa consommation.;morue-copy.jpg
https://www.academiedugout.fr/ingredients/bulot_834;Bulot;"Ce mollusque marin, qui se nomme aussi buccin, appartient, comme l’escargot, à la famille des gastéropodes, terme qui signifie « ventre sur pied ». Il vit sur toutes les côtes de l’Atlantique nord, depuis l’océan Arctique jusqu’aux côtes de l’Amérique du Nord et jusqu’au Portugal pour les côtes européennes.Différentes espèces de bulots existent, mais la plus commune est celle dont le nom scientifique est Buccinum undatum, d’où cet autre nom de « buccin ». Le corps du bulot est constitué d’un pied blanc tacheté de noir, qui est la partie comestible et la plus grosse, et d’une tête qui porte deux tentacules. Bien évidemment, il possède aussi des organes digestifs, un cœur et des branchies pour pouvoir respirer sous l’eau ; celles-ci sont reliées à un siphon. Le tout supporte une coquille très dure, jaune ou brune, pointue et en forme de spirale. N’en sortent que le pied et la tête ; le reste demeure toujours au fond. Quand le bulot se réfugie dans sa coquille, il déclenche la fermeture d’un opercule, petit disque marron clair qui le protège parfaitement des prédateurs. Il le replie quand il veut en sortir pour aller se nourrir. Un bulot mesure de 3 à 9 cm, mais les plus âgés peuvent atteindre 12 à 15 cm. Sa coquille grandit en même temps que lui. Le bulot vit dans les fonds vaseux et sableux jusqu’à 200 m de profondeur. C’est un nécrophage qui se nourrit des cadavres frais de crabes, de vers et de coquillages qu’il détecte grâce à ses tentacules.On le trouve quasiment toute l’année.";bulot_000.jpg
https://www.academiedugout.fr/ingredients/omble-chevalier_473;Omble chevalier;L’omble chevalier, ou omble arctique, est un poisson d’eau douce. On le trouve notamment dans les lacs de montagne où les eaux sont froides. Sa peau est grise et tachetée sur les côtés tandis qu’elle prend un teint orangé au niveau du ventre. L’omble chevalier appartient à la même famille que lesaumonet latruiteet est réputé pour sa chair rosée goûteuse et délicate.;fotolia_30402920_subscription_xxl-copy.jpg
https://www.academiedugout.fr/ingredients/carpe_450;Carpe;On trouve ce poisson d’eau douce dans les cours d’eau d’Europe, d’Amérique du Nord, d’Afrique ou d’Asie. En général, la carpe pèse une dizaine de kilos et mesure une quarantaine de centimètres. Mais on peut trouver des spécimens bien plus imposants allant jusqu’à 25 kilos et mesurant plus de 70 centimètres.;fotolia_60025309_subscription_xl-copy.jpg
https://www.academiedugout.fr/ingredients/carrelet-ou-plie_451;Carrelet (Plie);Le carrelet, également appelée plie commune, est un poisson plat vivant dans l’Atlantique et le Pacifique. Ce cousin de la barbue se distingue par sa peau brune tachetée d’orange. LePleuronectes platessamesure généralement une trentaine de centimètres pour un poids allant de 3 à 7 kilos. Attention toutefois : cette espèce est victime de la surpêche. Les quotas de pêche sont souvent dépassés, et en 20 ans, le nombre de géniteurs a été divisée par deux.;fotolia_15622652_subscription_xl-copy.jpg
https://www.academiedugout.fr/ingredients/colin_867;Colin;En France, le nom de colin sème vraiment la confusion car il désigne le merlu, et parfois lelieu noir. Lecolinotest toujours un merlu de petite taille, aussi appelé merluchon.Mais le colin d’Alaska est un colin, pas un merlu. Et en Méditerranée, le merlu se nomme aussi merlan. Colin ou merlu, colin d’Alaska, lieu : tous sont des membres de l’imposante famille des gadidés.;colin_000.jpg
https://www.academiedugout.fr/ingredients/coques_453;Coques;Les coques sont des fruits de mer à la coquille arrondie et striée verticalement. Elles renferment une petit noix ferme et charnue, ourlée d'un liseré orange appelé « corail ». Les coques sont ramassées à l'aide d'un râteau, sur les plages de l'Atlantique soumises aux marées. Peu caloriques, elles sont riches en fer, phosphore, zinc et sont bien pourvues en calcium et magnésium.;fotolia_47937603_subscription_xl-copy.jpg
https://www.academiedugout.fr/ingredients/coquille-saint-jacques_872;Coquille Saint-Jacques;"La coquille Saint-Jacques est un mollusque bivalve, ce qui signifie que sa coquille est constituée de deux parties distinctes et attachées. À l’intérieur, on trouve son appareil digestif, le manteau et les branchies, une noix ronde et blanche, qui est son muscle, etle corail, masse orange et blanche en forme de croissant, qui est son appareil reproducteur. Le pétoncle, cousin de la saint-jacques, est constitué de la même façon. Il se distingue par la forme de ses valves, qui sont bombées des deux côtés, tandis que la coquille Saint-Jacques est plate d’un côté et bombée de l’autre. La noix de pétoncle est plus petite et moins savoureuse. Ces deux coquillages sont hermaphrodites ; la partie mâle du corail est blanchâtre, la partie femelle est orangée. Ils appartiennent tous deux à la famille des pectinidés.";coquille-saint-jacques_000.jpg
https://www.academiedugout.fr/ingredients/couteaux_455;Couteaux;Le couteau de mer – ou solen - est un coquillage appartenant à la famille des Solenidae. Il doit son nom à sa forme de manche de couteau. Riche en protéines, ce mollusque de 10 à 20 cm de long vit enfoui dans le sable et est récolté à la faveur des marées basses le long de la côte atlantique. Il est repérable aux petits trous en forme de serrure qu'il forme dans le sable. Un peu de sel versé dans cet orifice permet de faire sortir le couteau de sa cachette.;fotolia_35828874_subscription_xxl-copy.jpg
https://www.academiedugout.fr/ingredients/crabe_882;Crabe;Les crustacés que sont les crabes sont tous rassemblés dans l’immense famille des décapodes marcheurs : ils nagent dans l’eau et peuvent tout aussi bien marcher sur la terre. Caractéristiques communes : un abdomen plus ou moins petit, replié sous une carapace très rigide mais dont ils doivent changer au fur et à mesure de leur croissance, et cinq paires de pattes. La première d’entre elles est toujours munie de pinces fortes qu’ils utilisent pour saisir et broyer leurs proies. Selon les espèces, les autres paires de pattes sont plus ou moins importantes. Il y a de multiples crabes dans toutes les mers du monde.;crabe_000.jpg
https://www.academiedugout.fr/ingredients/crevettes-roses_457;Crevettes roses;Les crevettes roses désignent les crevettes « cocktail » ou « bouquet ». Plus petites que les gambas, elles peuvent être issues d'élevage tropical (pénaeides) ou des mers froides (Atlantique du Nord voire Chili).;fotolia_50087349_subscription_xl-copy.jpg
