URL;Titre;Description;ImageFilename
https://www.academiedugout.fr/ingredients/tarama_478;Tarama;Spécialité grecque que l’on retrouve également dans la cuisine turque, le tarama est une purée onctueuse d’œufs de poissons séchés, de mie de pain, d’huile d’olive et de citron. Les œufs utilisés sont souvent issus de mulet ou de cabillaud. Si la pâte obtenue est parfois rosée, la belle couleur rose que l’on retrouve dans le commerce est due à l’utilisation du colorant E120, fabriqué à base d’insectes Dactylopius coccus (cochenille).;fotolia_62499543_subscription_l-copy.jpg
https://www.academiedugout.fr/ingredients/thon-albacore_1223;Thon;"Sous l'appellation thon, on rassemble plusieurs grands, et souvent très gros poissons, appartenant à la famille des scombridés et plus particulièrement à celle des thonidés. Ils ont un corps allongé, un dos bleu, un ventre plus ou moins argenté selon les espèces. Le thon est un poisson qui vit en bancs dans presque toutes les mers tempérées du monde et se nourrit de petits poissons. Il migre au printemps, après avoir frayé, remontant vers des eaux plus froides pour mieux s'y nourrir. On trouve lethon jaune, lethon blancet le thon rouge qui a toujours été une espèce admirée pour la beauté de sa silhouette et recherché pour la qualité exceptionnelle de sa chair. C'est désormais une espèce menacée. En gastronomie, on le qualifie souvent de ""steak de la mer"".";thon_000.jpg
https://www.academiedugout.fr/ingredients/thon-blanc-germon_479;Thon blanc (germon);Dans les pays anglophones, on l’appelle le thon « albacore ». Pourtant, en France, l’albacore désigne lethon jaune. Ici, leThunnus alalungaest appelé « thon blanc » ou germon. Contrairement à ses cousins péchés dans les régions tropicales, on trouve le thon blanc dans l’Atlantique et la Méditerranée. C’est un des thons les plus petits : il ne mesure qu’un mètre (le thon rouge peut mesurer plus de trois mètres !). Plus fin, plus rare, plus cher, le germon est à n’en pas douter un mets d’exception : « le thon, c'est bon, mais le thon blanc c'est excellent », disait une réclame des années 80.;fotolia_55139923_subscription_l.jpg
https://www.academiedugout.fr/ingredients/tilapia-du-nil_481;Tilapia du Nil;C’est le poisson le plus consommé au monde. Le tilapia du Nil est un poisson d’élevage, le premier élevé par l’homme. Originaire d’Afrique, le tilapia a petit à petit été introduit dans plusieurs régions du globe, de la Thaïlande au Brésil en passant par les Etats-Unis. Depuis quelques décennies, sa production est en boom permanent.;fotolia_49156824_subscription_xxl-copy.jpg
https://www.academiedugout.fr/ingredients/truite_1222;Truite;Le nom truite désigne différents poissons mais appartenant tous à la famille des salmonidés. La plupart des truites vivent sur tous les continents, dans des rivières où l'eau est claire, vive, et non polluée. Mais certaines truites, comme leur cousin lesaumon, vivent dans la mer et reviennent se reproduire en eau douce. La truite a un corps allongé, argenté, sans écailles et sa peau est parsemée de petits points de couleurs différentes selon les espèces. La truite est élevée en aquaculture mais sa pêche à la mouche continue d'alimenter la passion des pêcheurs.;truite_000.jpg
https://www.academiedugout.fr/ingredients/turbot_1221;Turbot;"Le turbot est un poisson plat et sans écailles dont les nageoires ventrale et dorsale lui donnent une forme presque rectangulaire lorsqu'il les déploie pour se déplacer. Son corps a en moyenne un diamètre de 40 à 50 cm (30 quand il a 3 à 4 ans, âge où il peut être commercialisé). Ses yeux se trouvent sur le côté gauche de sa tête. Le turbot adapte la couleur de sa peau à celle du fond marin dans lequel il vit. C'est pourquoi certains ont des dos jaune clair, d'autres gris, brun, presque noir mais toujours parsemés de taches foncées qui reproduisent celles des graviers ou des coquillages. L'autre face est blanc crème, sans pigmentation. La finesse de sa chair lui ont valu le qualificatif de ""Prince des mers"".";turbot_000.jpg
https://www.academiedugout.fr/ingredients/stockfish_476;Stockfish;Le stockfish, spécialité norvégienne fameuse – on dit qu’un bon stockfish a le même raffinement qu’un jambon fumé d’exception ou qu’un alcool bien vieilli – désigne un filet demorueséché. En version originale, c’est le Tørrfisk. Le cabillaud est salé et préparé (vidé, écaillé) avant d’être séché à l’air libre entre fin février et mai. Avant d’être utilisé, par exemple dans la brandade nîmoise ou l’estocafic niçois, il est nécessaire de le réhydrater, une préparation qui prend plusieurs jours.;fotolia_62122716_subscription_xxl-copy.jpg
https://www.academiedugout.fr/ingredients/caviar_2925;Caviar;"Le mot ""caviar"" désigne un ensemble d’œufs d'esturgeon salés puis mis en boîte que l'on déguste seul ou comme condiment. Ces perles aux reflets nacrés dont les couleurs oscillent entre le noir profond et le doré ne sont pas à la portée de toutes les bourses : le kilo de caviar peut avoisiner les 5000 euros. La pêche à l'esturgeon sauvage étant interdit depuis 2008, le caviar provient d’esturgeons élevés en bassin ou dans des lacs situés dans différents pays comme la Bulgarie, l'Italie, l'Uruguay, la France et la Chine en tête. Le caviar, dont le goût diffère selon l'espèce et l'affinage, est un produit de luxe qui entend conquérir le grand public.";fotolia_77292070_subscription_xxl.jpg
https://www.academiedugout.fr/ingredients/cobia_3266;Cobia;Le cobia est un poisson rare et méconnu en France. Il faut dire qu’il ne fait l’objet d’aucune pêche ciblée malgré la délicatesse de sa saveur et sa chair ferme, à savourer aussi bien crue que cuite. On le trouve généralement dans les eaux chaudes des Caraïbes et du Golfe du Mexique où on l’appelle aussi saumon noir, black kingfish, mafou, mangeur de crabe, poisson du Capitaine... Malgré son goût délicat et sa chair ferme, il ne fait l’objet d’aucune pêche ciblée car solitaire à l’état sauvage. Il est aujourd’hui disponible grâce à la société Open Blue qui élève son Cobia, certifié ASC, au large du Panama, dans la Mer des Caraïbes.;cobiawhole.jpg
